{
  "meta": {
    "built_by": "pipeline/run_daily.py",
    "task": "45-daily-run (docs/tasks/45-daily-run.md)",
    "schema": "pipeline/schemas/run_daily_status.schema.json",
    "generated_at": "2026-10-30T05:43:32+00:00"
  },
  "last_run": "2026-10-30T06:36:19+01:00",
  "ok": true,
  "steps": {
    "forecast": {
      "status": "ok",
      "started_at": "2026-10-30T06:36:19+01:00",
      "finished_at": "2026-10-30T06:36:25+01:00",
      "exit_code": 0,
      "seconds": 6.6
    },
    "imerg": {
      "status": "ok",
      "started_at": "2026-10-30T06:36:25+01:00",
      "finished_at": "2026-10-30T06:43:30+01:00",
      "exit_code": 0,
      "seconds": 425.0
    },
    "score_forecasts": {
      "status": "ok",
      "started_at": "2026-10-30T06:43:30+01:00",
      "finished_at": "2026-10-30T06:43:31+01:00",
      "exit_code": 0,
      "seconds": 1.1
    }
  },
  "imerg_through": "2026-10-28",
  "n_scored": 2380
}
